2024,11,MQ,Envoy Air,PIA,"Peoria, IL: General Downing - Peoria International",92.00,14.00,6.01,0.21,4.40,0.00,3.37,1.00,1.00,1129.00,603.00,36.00,150.00,0.00,340.00
2024,11,MQ,Envoy Air,PIT,"Pittsburgh, PA: Pittsburgh International",69.00,10.00,2.14,0.17,6.40,0.00,1.29,0.00,1.00,558.00,145.00,32.00,242.00,0.00,139.00
2024,11,MQ,Envoy Air,PNS,"Pensacola, FL: Pensacola International",133.00,7.00,2.93,0.00,2.57,0.00,1.49,0.00,0.00,206.00,88.00,0.00,53.00,0.00,65.00
2024,11,MQ,Envoy Air,PSP,"Palm Springs, CA: Palm Springs International",1.00,0.00,0.00,0.00,0.00,0.00,0.00,0.00,0.00,0.00,0.00,0.00,0.00,0.00,0.00
2024,11,MQ,Envoy Air,PVD,"Providence, RI: Rhode Island Tf Green International",33.00,5.00,1.00,0.19,3.81,0.00,0.00,0.00,0.00,211.00,18.00,22.00,171.00,0.00,0.00
2024,11,MQ,Envoy Air,PWM,"Portland, ME: Portland International Jetport",11.00,1.00,0.61,0.00,0.00,0.00,0.39,0.00,0.00,100.00,61.00,0.00,0.00,0.00,39.00
2024,11,MQ,Envoy Air,RAP,"Rapid City, SD: Rapid City Regional",72.00,10.00,1.55,0.61,1.65,0.00,6.19,0.00,1.00,502.00,36.00,45.00,46.00,0.00,375.00
2024,11,MQ,Envoy Air,RDM,"Bend/Redmond, OR: Roberts Field",55.00,2.00,0.96,0.00,0.04,0.00,1.00,0.00,0.00,80.00,25.00,0.00,1.00,0.00,54.00
2024,11,MQ,Envoy Air,RDU,"Raleigh/Durham, NC: Raleigh-Durham International",69.00,5.00,1.53,0.19,2.81,0.00,0.47,0.00,0.00,172.00,77.00,9.00,78.00,0.00,8.00
2024,11,MQ,Envoy Air,RIC,"Richmond, VA: Richmond International",15.00,2.00,1.05,0.00,0.00,0.00,0.95,0.00,0.00,70.00,49.00,0.00,0.00,0.00,21.00
2024,11,MQ,Envoy Air,RNO,"Reno, NV: Reno/Tahoe International",5.00,0.00,0.00,0.00,0.00,0.00,0.00,0.00,0.00,0.00,0.00,0.00,0.00,0.00,0.00
2024,11,MQ,Envoy Air,ROC,"Rochester, NY: Frederick Douglass Grtr Rochester International",94.00,12.00,2.68,1.64,2.71,0.00,4.97,0.00,0.00,719.00,89.00,172.00,160.00,0.00,298.00
2024,11,MQ,Envoy Air,RST,"Rochester, MN: Rochester International",6.00,2.00,1.00,0.00,0.00,0.00,1.00,0.00,0.00,186.00,151.00,0.00,0.00,0.00,35.00
2024,11,MQ,Envoy Air,SAT,"San Antonio, TX: San Antonio International",9.00,1.00,0.00,0.00,0.93,0.00,0.07,0.00,0.00,27.00,0.00,0.00,25.00,0.00,2.00
2024,11,MQ,Envoy Air,SAV,"Savannah, GA: Savannah/Hilton Head International",132.00,8.00,3.66,0.00,0.67,0.00,3.68,0.00,0.00,506.00,110.00,0.00,14.00,0.00,382.00
2024,11,MQ,Envoy Air,SBA,"Santa Barbara, CA: Santa Barbara Municipal",46.00,1.00,0.47,0.00,0.00,0.00,0.53,0.00,1.00,19.00,9.00,0.00,0.00,0.00,10.00
2024,11,MQ,Envoy Air,SBP,"San Luis Obispo, CA: San Luis County Regional",7.00,0.00,0.00,0.00,0.00,0.00,0.00,0.00,0.00,0.00,0.00,0.00,0.00,0.00,0.00
2024,11,MQ,Envoy Air,SDF,"Louisville, KY: Louisville Muhammad Ali International",82.00,13.00,6.09,0.57,2.89,0.00,3.46,0.00,0.00,748.00,190.00,133.00,140.00,0.00,285.00
2024,11,MQ,Envoy Air,SEA,"Seattle, WA: Seattle/Tacoma International",10.00,1.00,0.00,0.00,1.00,0.00,0.00,0.00,0.00,16.00,0.00,0.00,16.00,0.00,0.00
2024,11,MQ,Envoy Air,SGF,"Springfield, MO: Springfield-Branson National",319.00,41.00,12.92,2.76,15.55,0.00,9.76,3.00,1.00,2178.00,438.00,437.00,503.00,0.00,800.00
2024,11,MQ,Envoy Air,SHV,"Shreveport, LA: Shreveport Regional",78.00,6.00,0.28,0.42,3.03,0.00,2.27,1.00,0.00,396.00,7.00,51.00,143.00,0.00,195.00
2024,11,MQ,Envoy Air,SJC,"San Jose, CA: Norman Y. Mineta San Jose International",34.00,6.00,1.59,0.00,3.06,0.00,1.35,0.00,0.00,212.00,67.00,0.00,108.00,0.00,37.00
2024,11,MQ,Envoy Air,SJT,"San Angelo, TX: San Angelo Regional/Mathis Field",12.00,2.00,0.00,0.08,0.27,0.00,1.65,0.00,0.00,104.00,0.00,3.00,18.00,0.00,83.00
2024,11,MQ,Envoy Air,SLC,"Salt Lake City, UT: Salt Lake City International",48.00,7.00,2.51,0.02,4.47,0.00,0.00,0.00,0.00,343.00,142.00,3.00,198.00,0.00,0.00
2024,11,MQ,Envoy Air,SPS,"Wichita Falls, TX: Sheppard AFB/Wichita Falls Municipal",51.00,4.00,2.00,0.00,1.00,0.00,1.00,1.00,0.00,120.00,58.00,0.00,44.00,0.00,18.00
2024,11,MQ,Envoy Air,STL,"St. Louis, MO: St Louis Lambert International",106.00,11.00,4.52,0.12,4.17,0.00,2.20,0.00,1.00,526.00,201.00,13.00,170.00,0.00,142.00
2024,11,MQ,Envoy Air,STS,"Santa Rosa, CA: Charles M. Schulz - Sonoma County",49.00,8.00,1.09,0.00,6.91,0.00,0.00,0.00,1.00,376.00,67.00,0.00,309.00,0.00,0.00
2024,11,MQ,Envoy Air,SYR,"Syracuse, NY: Syracuse Hancock International",76.00,9.00,3.68,0.24,0.17,0.00,4.91,0.00,1.00,369.00,128.00,21.00,15.00,0.00,205.00
2024,11,MQ,Envoy Air,TLH,"Tallahassee, FL: Tallahassee International",218.00,28.00,9.24,0.35,7.65,0.00,10.76,2.00,0.00,1338.00,441.00,20.00,261.00,0.00,616.00
2024,11,MQ,Envoy Air,TPA,"Tampa, FL: Tampa International",133.00,12.00,5.01,0.00,1.04,0.00,5.95,0.00,0.00,397.00,138.00,0.00,38.00,0.00,221.00
2024,11,MQ,Envoy Air,TRI,"Bristol/Johnson City/Kingsport, TN: Tri Cities",8.00,2.00,0.00,1.58,0.42,0.00,0.00,0.00,0.00,251.00,0.00,154.00,97.00,0.00,0.00
2024,11,MQ,Envoy Air,TUL,"Tulsa, OK: Tulsa International",83.00,11.00,3.07,0.15,4.92,0.00,2.85,2.00,0.00,636.00,268.00,8.00,212.00,0.00,148.00
2024,11,MQ,Envoy Air,TUS,"Tucson, AZ: Tucson International",64.00,3.00,0.69,0.00,0.00,0.00,2.31,0.00,0.00,64.00,13.00,0.00,0.00,0.00,51.00
2024,11,MQ,Envoy Air,TVC,"Traverse City, MI: Cherry Capital",48.00,7.00,2.62,0.09,2.78,0.00,1.51,0.00,0.00,419.00,169.00,12.00,129.00,0.00,109.00
2024,11,MQ,Envoy Air,TYS,"Knoxville, TN: McGhee Tyson",68.00,10.00,3.61,0.12,4.55,0.00,1.72,0.00,0.00,444.00,211.00,2.00,198.00,0.00,33.00
2024,11,MQ,Envoy Air,VPS,"Valparaiso, FL: Eglin AFB Destin Fort Walton Beach",90.00,8.00,3.97,0.00,1.00,0.00,3.03,0.00,0.00,339.00,199.00,0.00,16.00,0.00,124.00
2024,11,MQ,Envoy Air,XNA,"Fayetteville, AR: Northwest Arkansas National",501.00,41.00,4.75,3.52,15.32,0.00,17.42,3.00,2.00,2919.00,195.00,435.00,610.00,0.00,1679.00
2024,11,MQ,Envoy Air,YUM,"Yuma, AZ: Yuma MCAS/Yuma International",38.00,4.00,2.00,0.00,0.00,1.00,1.00,0.00,0.00,145.00,64.00,0.00,0.00,20.00,61.00
2024,11,NK,Spirit Airlines,ABQ,"Albuquerque, NM: Albuquerque International Sunport",26.00,3.00,1.00,0.00,2.00,0.00,0.00,0.00,0.00,110.00,32.00,0.00,78.00,0.00,0.00
2024,11,NK,Spirit Airlines,ACY,"Atlantic City, NJ: Atlantic City International",241.00,26.00,8.47,0.00,8.06,0.00,9.48,0.00,0.00,2086.00,756.00,0.00,392.00,0.00,938.00
2024,11,NK,Spirit Airlines,ATL,"Atlanta, GA: Hartsfield-Jackson Atlanta International",842.00,237.00,37.82,0.00,151.59,1.73,45.87,3.00,0.00,14130.00,2536.00,0.00,7407.00,38.00,4149.00
2024,11,NK,Spirit Airlines,AUS,"Austin, TX: Austin - Bergstrom International",101.00,6.00,2.40,0.00,2.60,0.00,1.00,0.00,0.00,656.00,242.00,0.00,366.00,0.00,48.00
2024,11,NK,Spirit Airlines,BDL,"Hartford, CT: Bradley International",58.00,8.00,2.59,0.00,3.75,0.00,1.66,0.00,0.00,411.00,75.00,0.00,231.00,0.00,105.00
2024,11,NK,Spirit Airlines,BHM,"Birmingham, AL: Birmingham-Shuttlesworth International",26.00,2.00,1.13,0.00,0.05,0.00,0.82,0.00,0.00,91.00,42.00,0.00,3.00,0.00,46.00
2024,11,NK,Spirit Airlines,BNA,"Nashville, TN: Nashville International",254.00,39.00,9.37,0.00,20.68,0.00,8.95,0.00,0.00,2657.00,622.00,0.00,1351.00,0.00,684.00
2024,11,NK,Spirit Airlines,BOI,"Boise, ID: Boise Air Terminal",33.00,3.00,1.00,0.00,0.09,0.00,1.91,0.00,0.00,162.00,74.00,0.00,3.00,0.00,85.00
2024,11,NK,Spirit Airlines,BOS,"Boston, MA: Logan International",464.00,65.00,12.14,0.00,41.25,0.00,11.61,0.00,0.00,4097.00,702.00,0.00,2800.00,0.00,595.00
2024,11,NK,Spirit Airlines,BUR,"Burbank, CA: Bob Hope",215.00,26.00,9.46,0.00,11.89,0.00,4.65,1.00,1.00,1033.00,472.00,0.00,419.00,0.00,142.00
2024,11,NK,Spirit Airlines,BWI,"Baltimore, MD: Baltimore/Washington International Thurgood Marshall",530.00,76.00,23.29,1.71,33.07,0.00,17.93,1.00,0.00,5031.00,2000.00,56.00,1910.00,0.00,1065.00
2024,11,NK,Spirit Airlines,CHS,"Charleston, SC: Charleston AFB/International",79.00,11.00,4.58,0.00,3.42,0.00,3.00,0.00,0.00,762.00,482.00,0.00,83.00,0.00,197.00
2024,11,NK,Spirit Airlines,CLE,"Cleveland, OH: Cleveland-Hopkins International",35.00,5.00,4.13,0.00,0.87,0.00,0.00,0.00,0.00,210.00,171.00,0.00,39.00,0.00,0.00
2024,11,NK,Spirit Airlines,CLT,"Charlotte, NC: Charlotte Douglas International",340.00,36.00,13.41,0.00,12.81,0.00,9.78,2.00,0.00,2261.00,1240.00,0.00,505.00,0.00,516.00
2024,11,NK,Spirit Airlines,CMH,"Columbus, OH: John Glenn Columbus International",176.00,16.00,4.65,0.00,4.25,0.00,7.11,0.00,0.00,911.00,268.00,0.00,163.00,0.00,480.00
2024,11,NK,Spirit Airlines,DFW,"Dallas/Fort Worth, TX: Dallas/Fort Worth International",778.00,152.00,48.09,0.45,76.63,1.15,25.67,7.00,5.00,9156.00,2783.00,39.00,4099.00,68.00,2167.00
2024,11,NK,Spirit Airlines,DTW,"Detroit, MI: Detroit Metro Wayne County",806.00,114.00,39.77,2.04,36.02,0.30,35.86,0.00,0.00,7905.00,2621.00,52.00,2303.00,19.00,2910.00
2024,11,NK,Spirit Airlines,EWR,"Newark, NJ: Newark Liberty International",841.00,218.00,27.15,1.00,173.32,0.00,16.53,6.00,4.00,15455.00,1897.00,47.00,12287.00,0.00,1224.00
2024,11,NK,Spirit Airlines,FLL,"Fort Lauderdale, FL: Fort Lauderdale-Hollywood International",1960.00,250.00,82.89,0.15,90.85,0.00,76.11,3.00,0.00,16128.00,5195.00,41.00,5083.00,0.00,5809.00
2024,11,NK,Spirit Airlines,IAH,"Houston, TX: George Bush Intercontinental/Houston",840.00,116.00,38.93,1.00,43.54,0.00,32.53,1.00,0.00,8739.00,2949.00,128.00,2144.00,0.00,3518.00
2024,11,NK,Spirit Airlines,IND,"Indianapolis, IN: Indianapolis International",167.00,12.00,7.54,0.00,2.09,0.06,2.31,0.00,0.00,828.00,601.00,0.00,88.00,2.00,137.00
2024,11,NK,Spirit Airlines,LAS,"Las Vegas, NV: Harry Reid International",2071.00,302.00,76.46,4.30,156.60,1.79,62.85,6.00,0.00,17433.00,6091.00,106.00,7377.00,124.00,3735.00
2024,11,NK,Spirit Airlines,LAX,"Los Angeles, CA: Los Angeles International",898.00,126.00,44.51,2.97,53.08,0.16,25.27,1.00,0.00,7817.00,2959.00,810.00,2375.00,8.00,1665.00
2024,11,NK,Spirit Airlines,LBE,"Latrobe, PA: Arnold Palmer Regional",38.00,2.00,0.01,0.00,0.99,0.00,1.00,0.00,0.00,309.00,2.00,0.00,139.00,0.00,168.00
2024,11,NK,Spirit Airlines,LGA,"New York, NY: LaGuardia",657.00,78.00,22.51,1.00,42.26,0.22,12.01,1.00,0.00,4648.00,1248.00,23.00,2093.00,15.00,1269.00
2024,11,NK,Spirit Airlines,MCI,"Kansas City, MO: Kansas City International",161.00,15.00,6.65,0.00,3.73,0.00,4.62,1.00,0.00,668.00,195.00,0.00,328.00,0.00,145.00
2024,11,NK,Spirit Airlines,MCO,"Orlando, FL: Orlando International",1607.00,159.00,37.01,1.49,67.80,0.00,52.71,9.00,0.00,11206.00,2460.00,133.00,4799.00,0.00,3814.00
2024,11,NK,Spirit Airlines,MEM,"Memphis, TN: Memphis International",56.00,4.00,1.78,0.00,1.23,0.07,0.92,0.00,0.00,203.00,54.00,0.00,74.00,5.00,70.00
2024,11,NK,Spirit Airlines,MIA,"Miami, FL: Miami International",299.00,31.00,6.48,0.00,17.90,0.00,6.62,1.00,0.00,1648.00,364.00,0.00,669.00,0.00,615.00
2024,11,NK,Spirit Airlines,MKE,"Milwaukee, WI: General Mitchell International",52.00,3.00,1.38,0.00,1.62,0.00,0.00,0.00,0.00,117.00,89.00,0.00,28.00,0.00,0.00
2024,11,NK,Spirit Airlines,MSP,"Minneapolis, MN: Minneapolis-St Paul International",99.00,14.00,7.08,0.00,5.13,0.00,1.79,1.00,0.00,768.00,399.00,0.00,161.00,0.00,208.00
2024,11,NK,Spirit Airlines,MSY,"New Orleans, LA: Louis Armstrong New Orleans International",482.00,60.00,20.22,1.00,24.72,0.28,13.78,2.00,0.00,4246.00,1604.00,40.00,1869.00,14.00,719.00
2024,11,NK,Spirit Airlines,MYR,"Myrtle Beach, SC: Myrtle Beach International",305.00,40.00,7.95,0.00,20.74,0.00,11.31,1.00,0.00,2580.00,536.00,0.00,1131.00,0.00,913.00
2024,11,NK,Spirit Airlines,OAK,"Oakland, CA: Metro Oakland International",239.00,27.00,9.35,0.00,12.88,0.00,4.76,0.00,0.00,1730.00,754.00,0.00,710.00,0.00,266.00
2024,11,NK,Spirit Airlines,ORD,"Chicago, IL: Chicago O'Hare International",593.00,94.00,25.68,0.59,46.98,1.00,19.76,0.00,1.00,4520.00,1302.00,89.00,1994.00,33.00,1102.00
2024,11,NK,Spirit Airlines,ORF,"Norfolk, VA: Norfolk International",51.00,5.00,4.27,0.00,0.73,0.00,0.00,0.00,0.00,361.00,335.00,0.00,26.00,0.00,0.00
2024,11,NK,Spirit Airlines,PBI,"West Palm Beach/Palm Beach, FL: Palm Beach International",29.00,4.00,2.16,0.00,1.03,0.00,0.81,1.00,0.00,644.00,551.00,0.00,67.00,0.00,26.00
2024,11,NK,Spirit Airlines,PDX,"Portland, OR: Portland International",63.00,7.00,2.25,0.00,3.90,0.00,0.85,0.00,0.00,325.00,102.00,0.00,189.00,0.00,34.00
2024,11,NK,Spirit Airlines,PHL,"Philadelphia, PA: Philadelphia International",345.00,43.00,14.08,0.00,12.68,0.00,16.24,1.00,0.00,2233.00,687.00,0.00,498.00,0.00,1048.00
2024,11,NK,Spirit Airlines,PHX,"Phoenix, AZ: Phoenix Sky Harbor International",53.00,10.00,3.88,0.00,6.12,0.00,0.00,0.00,0.00,484.00,356.00,0.00,128.00,0.00,0.00
2024,11,NK,Spirit Airlines,PIT,"Pittsburgh, PA: Pittsburgh International",181.00,35.00,7.64,0.00,21.30,0.00,6.06,2.00,0.00,2190.00,392.00,0.00,1294.00,0.00,504.00
2024,11,NK,Spirit Airlines,PNS,"Pensacola, FL: Pensacola International",61.00,2.00,2.00,0.00,0.00,0.00,0.00,0.00,0.00,72.00,72.00,0.00,0.00,0.00,0.00
2024,11,NK,Spirit Airlines,RDU,"Raleigh/Durham, NC: Raleigh-Durham International",41.00,10.00,5.36,0.00,2.92,0.00,1.72,0.00,0.00,1270.00,467.00,0.00,740.00,0.00,63.00
2024,11,NK,Spirit Airlines,RIC,"Richmond, VA: Richmond International",63.00,7.00,3.81,0.00,1.96,0.00,1.23,0.00,0.00,381.00,236.00,0.00,82.00,0.00,63.00
2024,11,NK,Spirit Airlines,RNO,"Reno, NV: Reno/Tahoe International",110.00,5.00,2.00,0.00,1.13,0.00,1.87,0.00,0.00,163.00,40.00,0.00,52.00,0.00,71.00
2024,11,NK,Spirit Airlines,ROC,"Rochester, NY: Frederick Douglass Grtr Rochester International",52.00,6.00,2.89,0.00,2.15,0.00,0.95,0.00,0.00,369.00,213.00,0.00,114.00,0.00,42.00
2024,11,NK,Spirit Airlines,RSW,"Fort Myers, FL: Southwest Florida International",107.00,16.00,3.00,0.00,10.63,0.00,2.37,0.00,0.00,858.00,188.00,0.00,471.00,0.00,199.00
2024,11,NK,Spirit Airlines,SAN,"San Diego, CA: San Diego International",241.00,44.00,10.65,0.00,28.78,0.00,4.58,0.00,0.00,2128.00,549.00,0.00,1277.00,0.00,302.00
2024,11,NK,Spirit Airlines,SAT,"San Antonio, TX: San Antonio International",147.00,14.00,2.60,0.00,6.41,0.22,4.77,1.00,0.00,735.00,395.00,0.00,217.00,8.00,115.00
2024,11,NK,Spirit Airlines,SDF,"Louisville, KY: Louisville Muhammad Ali International",36.00,6.00,2.74,0.00,3.26,0.00,0.00,0.00,0.00,383.00,186.00,0.00,197.00,0.00,0.00
2024,11,NK,Spirit Airlines,SEA,"Seattle, WA: Seattle/Tacoma International",79.00,10.00,2.04,0.00,3.48,0.00,4.47,0.00,0.00,582.00,183.00,0.00,211.00,0.00,188.00
2024,11,NK,Spirit Airlines,SJC,"San Jose, CA: Norman Y. Mineta San Jose International",296.00,40.00,14.48,0.00,19.49,0.00,6.03,1.00,0.00,1689.00,669.00,0.00,728.00,0.00,292.00
2024,11,NK,Spirit Airlines,SJU,"San Juan, PR: Luis Munoz Marin International",283.00,45.00,21.16,0.00,19.61,0.00,4.23,2.00,0.00,2101.00,868.00,0.00,948.00,0.00,285.00
2024,11,NK,Spirit Airlines,SLC,"Salt Lake City, UT: Salt Lake City International",40.00,4.00,1.07,0.00,2.93,0.00,0.00,0.00,0.00,240.00,86.00,0.00,154.00,0.00,0.00
2024,11,NK,Spirit Airlines,SMF,"Sacramento, CA: Sacramento International",156.00,13.00,4.29,0.00,5.69,0.00,3.02,0.00,0.00,554.00,178.00,0.00,256.00,0.00,120.00
2024,11,NK,Spirit Airlines,SNA,"Santa Ana, CA: John Wayne Airport-Orange County",108.00,6.00,4.14,0.00,1.86,0.00,0.00,0.00,0.00,254.00,173.00,0.00,81.00,0.00,0.00
2024,11,NK,Spirit Airlines,STL,"St. Louis, MO: St Louis Lambert International",20.00,5.00,3.13,0.00,0.63,0.00,1.24,0.00,0.00,131.00,77.00,0.00,28.00,0.00,26.00
2024,11,NK,Spirit Airlines,STT,"Charlotte Amalie, VI: Cyril E King",72.00,3.00,1.00,0.00,2.00,0.00,0.00,0.00,2.00,91.00,39.00,0.00,52.00,0.00,0.00
2024,11,NK,Spirit Airlines,STX,"Christiansted, VI: Henry E. Rohlsen",18.00,3.00,1.00,0.00,2.00,0.00,0.00,0.00,0.00,156.00,20.00,0.00,136.00,0.00,0.00
2024,11,NK,Spirit Airlines,TPA,"Tampa, FL: Tampa International",438.00,56.00,21.32,0.00,19.24,0.55,14.89,0.00,0.00,3791.00,1137.00,0.00,1816.00,17.00,821.00
2024,11,OH,PSA Airlines Inc.,ABE,"Allentown/Bethlehem/Easton, PA: Lehigh Valley International",86.00,13.00,3.13,0.00,6.25,0.00,3.62,0.00,0.00,432.00,130.00,0.00,129.00,0.00,173.00
2024,11,OH,PSA Airlines Inc.,AGS,"Augusta, GA: Augusta Regional at Bush Field",121.00,19.00,8.03,1.67,5.88,0.00,3.43,0.00,0.00,1025.00,369.00,214.00,184.00,0.00,258.00
2024,11,OH,PSA Airlines Inc.,ALB,"Albany, NY: Albany International",80.00,13.00,6.21,0.00,0.27,0.00,6.52,0.00,0.00,531.00,217.00,0.00,8.00,0.00,306.00
2024,11,OH,PSA Airlines Inc.,ATL,"Atlanta, GA: Hartsfield-Jackson Atlanta International",262.00,35.00,10.49,1.00,12.38,0.00,11.13,0.00,2.00,1847.00,534.00,150.00,303.00,0.00,860.00
2024,11,OH,PSA Airlines Inc.,AVL,"Asheville, NC: Asheville Regional",143.00,20.00,7.55,0.00,5.56,0.00,6.90,0.00,0.00,1441.00,612.00,0.00,175.00,0.00,654.00
2024,11,OH,PSA Airlines Inc.,BDL,"Hartford, CT: Bradley International",67.00,11.00,1.93,0.00,2.60,0.98,5.50,0.00,0.00,849.00,141.00,0.00,87.00,39.00,582.00
2024,11,OH,PSA Airlines Inc.,BGR,"Bangor, ME: Bangor International",84.00,15.00,4.87,0.42,3.71,0.00,6.01,0.00,0.00,952.00,318.00,30.00,181.00,0.00,423.00
2024,11,OH,PSA Airlines Inc.,BHM,"Birmingham, AL: Birmingham-Shuttlesworth International",296.00,38.00,16.24,0.80,5.33,0.00,15.63,1.00,0.00,2608.00,1433.00,20.00,157.00,0.00,998.00
2024,11,OH,PSA Airlines Inc.,BNA,"Nashville, TN: Nashville International",227.00,24.00,8.57,0.00,5.81,0.00,9.61,0.00,0.00,1424.00,533.00,0.00,190.00,0.00,701.00
2024,11,OH,PSA Airlines Inc.,BTR,"Baton Rouge, LA: Baton Rouge Metropolitan/Ryan Field",128.00,16.00,6.51,0.40,1.69,0.00,7.40,0.00,0.00,1112.00,417.00,95.00,80.00,0.00,520.00
2024,11,OH,PSA Airlines Inc.,BTV,"Burlington, VT: Burlington International",122.00,15.00,5.10,0.00,1.98,0.00,7.92,0.00,0.00,1129.00,442.00,0.00,65.00,0.00,622.00
2024,11,OH,PSA Airlines Inc.,BUF,"Buffalo, NY: Buffalo Niagara International",81.00,16.00,5.76,0.00,2.75,0.00,7.49,0.00,0.00,816.00,319.00,0.00,63.00,0.00,434.00
2024,11,OH,PSA Airlines Inc.,CAE,"Columbia, SC: Columbia Metropolitan",204.00,34.00,11.48,0.00,11.51,0.14,10.87,0.00,0.00,1487.00,472.00,0.00,305.00,4.00,706.00
2024,11,OH,PSA Airlines Inc.,CAK,"Akron, OH: Akron-Canton Regional",136.00,28.00,9.36,2.40,5.11,0.00,11.13,0.00,0.00,2163.00,539.00,648.00,196.00,0.00,780.00
2024,11,OH,PSA Airlines Inc.,CHA,"Chattanooga, TN: Lovell Field",216.00,28.00,7.56,0.15,11.49,0.00,8.79,2.00,0.00,1206.00,239.00,13.00,295.00,0.00,659.00
2024,11,OH,PSA Airlines Inc.,CHO,"Charlottesville, VA: Charlottesville Albemarle",8.00,0.00,0.00,0.00,0.00,0.00,0.00,0.00,0.00,0.00,0.00,0.00,0.00,0.00,0.00
2024,11,OH,PSA Airlines Inc.,CHS,"Charleston, SC: Charleston AFB/International",144.00,16.00,5.82,0.00,2.86,0.00,7.31,0.00,0.00,897.00,352.00,0.00,88.00,0.00,457.00
2024,11,OH,PSA Airlines Inc.,CID,"Cedar Rapids/Iowa City, IA: The Eastern Iowa",61.00,3.00,1.53,0.00,0.15,0.00,1.32,0.00,0.00,310.00,169.00,0.00,17.00,0.00,124.00
2024,11,OH,PSA Airlines Inc.,CLE,"Cleveland, OH: Cleveland-Hopkins International",120.00,14.00,5.58,0.84,0.37,0.00,7.21,1.00,0.00,879.00,367.00,59.00,32.00,0.00,421.00
2024,11,OH,PSA Airlines Inc.,CLT,"Charlotte, NC: Charlotte Douglas International",4827.00,654.00,144.92,7.57,267.73,2.81,230.98,0.00,3.00,37617.00,13677.00,369.00,7042.00,89.00,16440.00
2024,11,OH,PSA Airlines Inc.,CMH,"Columbus, OH: John Glenn Columbus International",169.00,23.00,7.09,0.12,2.65,0.00,13.13,0.00,0.00,2643.00,264.00,6.00,63.00,0.00,2310.00
2024,11,OH,PSA Airlines Inc.,CRW,"Charleston/Dunbar, WV: West Virginia International Yeager",109.00,11.00,1.68,0.55,3.86,0.00,4.91,0.00,0.00,489.00,50.00,21.00,143.00,0.00,275.00
2024,11,OH,PSA Airlines Inc.,CVG,"Cincinnati, OH: Cincinnati/Northern Kentucky International",240.00,36.00,13.51,0.06,8.41,1.00,13.02,0.00,1.00,2407.00,1028.00,2.00,316.00,22.00,1039.00
2024,11,OH,PSA Airlines Inc.,DAB,"Daytona Beach, FL: Daytona Beach International",111.00,9.00,2.83,0.00,3.31,0.00,2.87,0.00,0.00,354.00,89.00,0.00,82.00,0.00,183.00
2024,11,OH,PSA Airlines Inc.,DAY,"Dayton, OH: James M Cox/Dayton International",286.00,38.00,16.53,1.05,4.35,0.00,16.07,0.00,0.00,2191.00,1149.00,126.00,196.00,0.00,720.00
2024,11,OH,PSA Airlines Inc.,DCA,"Washington, DC: Ronald Reagan Washington National",3316.00,506.00,127.53,7.76,192.42,0.91,177.38,5.00,17.00,38964.00,13664.00,1540.00,7525.00,44.00,16191.00
2024,11,OH,PSA Airlines Inc.,DFW,"Dallas/Fort Worth, TX: Dallas/Fort Worth International",839.00,121.00,37.94,8.81,26.98,0.12,47.15,10.00,1.00,14893.00,6063.00,913.00,1578.00,25.00,6314.00
2024,11,OH,PSA Airlines Inc.,DSM,"Des Moines, IA: Des Moines International",54.00,8.00,1.33,0.00,1.05,0.00,5.62,0.00,0.00,379.00,51.00,0.00,49.00,0.00,279.00
2024,11,OH,PSA Airlines Inc.,DTW,"Detroit, MI: Detroit Metro Wayne County",114.00,9.00,3.18,0.00,1.03,0.00,4.79,0.00,1.00,515.00,245.00,0.00,28.00,0.00,242.00
2024,11,OH,PSA Airlines Inc.,ECP,"Panama City, FL: Northwest Florida Beaches International",91.00,11.00,2.86,0.00,7.02,0.00,1.12,0.00,0.00,396.00,108.00,0.00,225.00,0.00,63.00
2024,11,OH,PSA Airlines Inc.,FAY,"Fayetteville, NC: Fayetteville Regional/Grannis Field",33.00,5.00,1.55,0.00,1.60,0.00,1.85,0.00,0.00,173.00,30.00,0.00,25.00,0.00,118.00
2024,11,OH,PSA Airlines Inc.,FWA,"Fort Wayne, IN: Fort Wayne International",58.00,10.00,2.99,0.00,3.54,0.00,3.47,0.00,0.00,426.00,206.00,0.00,86.00,0.00,134.00
2024,11,OH,PSA Airlines Inc.,GNV,"Gainesville, FL: Gainesville Regional",57.00,4.00,1.53,0.00,0.72,0.00,1.75,0.00,0.00,139.00,63.00,0.00,21.00,0.00,55.00
2024,11,OH,PSA Airlines Inc.,GPT,"Gulfport/Biloxi, MS: Gulfport-Biloxi International",87.00,11.00,5.28,0.00,1.20,0.00,4.52,0.00,0.00,494.00,189.00,0.00,40.00,0.00,265.00
2024,11,OH,PSA Airlines Inc.,GRR,"Grand Rapids, MI: Gerald R. Ford International",54.00,12.00,6.09,0.00,1.03,0.00,4.88,0.00,0.00,791.00,360.00,0.00,36.00,0.00,395.00
2024,11,OH,PSA Airlines Inc.,GSO,"Greensboro/High Point, NC: Piedmont Triad International",251.00,31.00,9.40,0.00,10.58,0.00,11.02,0.00,0.00,1261.00,381.00,0.00,297.00,0.00,583.00
2024,11,OH,PSA Airlines Inc.,GSP,"Greer, SC: Greenville-Spartanburg International",351.00,32.00,13.52,0.75,7.88,0.00,9.85,0.00,0.00,1899.00,949.00,108.00,192.00,0.00,650.00
2024,11,OH,PSA Airlines Inc.,HPN,"White Plains, NY: Westchester County",202.00,40.00,14.62,0.00,12.43,0.87,12.08,1.00,0.00,2084.00,813.00,0.00,378.00,20.00,873.00
2024,11,OH,PSA Airlines Inc.,HSV,"Huntsville, AL: Huntsville International-Carl T Jones Field",217.00,42.00,13.47,0.49,9.65,0.00,18.39,0.00,0.00,3417.00,1268.00,21.00,449.00,0.00,1679.00
2024,11,OH,PSA Airlines Inc.,IAD,"Washington, DC: Washington Dulles International",145.00,16.00,4.83,0.00,2.98,0.00,8.19,0.00,0.00,1418.00,683.00,0.00,102.00,0.00,633.00
2024,11,OH,PSA Airlines Inc.,IAH,"Houston, TX: George Bush Intercontinental/Houston",14.00,2.00,0.96,0.00,0.04,0.00,1.00,0.00,0.00,90.00,48.00,0.00,2.00,0.00,40.00
2024,11,OH,PSA Airlines Inc.,ICT,"Wichita, KS: Wichita Dwight D Eisenhower National",101.00,23.00,5.34,2.83,4.97,0.17,9.70,1.00,0.00,1168.00,315.00,130.00,200.00,16.00,507.00
2024,11,OH,PSA Airlines Inc.,ILM,"Wilmington, NC: Wilmington International",184.00,24.00,8.04,0.00,5.83,0.00,10.13,0.00,0.00,1254.00,403.00,0.00,199.00,0.00,652.00
2024,11,OH,PSA Airlines Inc.,IND,"Indianapolis, IN: Indianapolis International",37.00,1.00,0.00,0.00,0.00,0.00,1.00,0.00,0.00,16.00,0.00,0.00,0.00,0.00,16.00
2024,11,OH,PSA Airlines Inc.,JAN,"Jackson/Vicksburg, MS: Jackson Medgar Wiley Evers International",155.00,20.00,9.01,0.00,7.22,0.00,3.77,0.00,0.00,917.00,576.00,0.00,158.00,0.00,183.00
2024,11,OH,PSA Airlines Inc.,JAX,"Jacksonville, FL: Jacksonville International",113.00,5.00,0.70,0.00,1.05,0.00,3.26,0.00,0.00,472.00,56.00,0.00,39.00,0.00,377.00
2024,11,OH,PSA Airlines Inc.,LAN,"Lansing, MI: Capital Region International",24.00,1.00,0.00,0.00,0.68,0.00,0.32,1.00,0.00,22.00,0.00,0.00,15.00,0.00,7.00
2024,11,OH,PSA Airlines Inc.,LEX,"Lexington, KY: Blue Grass",165.00,19.00,10.46,1.12,3.77,0.00,3.64,0.00,0.00,995.00,538.00,59.00,90.00,0.00,308.00
2024,11,OH,PSA Airlines Inc.,LFT,"Lafayette, LA: Lafayette Regional Paul Fournet Field",83.00,17.00,7.48,0.46,3.96,0.00,5.10,1.00,0.00,1346.00,739.00,21.00,213.00,0.00,373.00
2024,11,OH,PSA Airlines Inc.,LIT,"Little Rock, AR: Bill and Hillary Clinton Nat Adams Field",103.00,9.00,0.67,0.00,5.56,0.00,2.78,2.00,0.00,328.00,28.00,0.00,182.00,0.00,118.00
2024,11,OH,PSA Airlines Inc.,MCI,"Kansas City, MO: Kansas City International",80.00,11.00,3.19,1.00,1.88,0.00,4.93,0.00,0.00,538.00,107.00,19.00,85.00,0.00,327.00
2024,11,OH,PSA Airlines Inc.,MDT,"Harrisburg, PA: Harrisburg International",85.00,17.00,9.77,0.00,5.15,0.00,2.08,0.00,0.00,689.00,419.00,0.00,163.00,0.00,107.00
2024,11,OH,PSA Airlines Inc.,MEM,"Memphis, TN: Memphis International",20.00,5.00,1.87,0.00,1.58,0.00,1.55,0.00,0.00,226.00,147.00,0.00,37.00,0.00,42.00
2024,11,OH,PSA Airlines Inc.,MGM,"Montgomery, AL: Montgomery Regional",50.00,5.00,1.37,0.36,2.41,0.00,0.85,1.00,0.00,507.00,220.00,8.00,68.00,0.00,211.00
2024,11,OH,PSA Airlines Inc.,MHT,"Manchester, NH: Manchester Boston Regional",206.00,25.00,11.19,0.00,3.76,0.00,10.05,0.00,0.00,1296.00,444.00,0.00,158.00,0.00,694.00
2024,11,OH,PSA Airlines Inc.,MKE,"Milwaukee, WI: General Mitchell International",53.00,4.00,2.00,0.00,0.84,0.00,1.16,0.00,0.00,315.00,129.00,0.00,52.00,0.00,134.00
2024,11,OH,PSA Airlines Inc.,MLB,"Melbourne, FL: Melbourne Orlando International",107.00,7.00,3.37,0.00,0.91,0.00,2.72,0.00,0.00,419.00,244.00,0.00,71.00,0.00,104.00
2024,11,OH,PSA Airlines Inc.,MLI,"Moline, IL: Quad Cities International",57.00,9.00,0.72,0.00,2.88,0.00,5.40,0.00,0.00,372.00,17.00,0.00,72.00,0.00,283.00
2024,11,OH,PSA Airlines Inc.,MSN,"Madison, WI: Dane County Regional-Truax Field",83.00,9.00,3.14,1.00,2.65,0.00,2.21,0.00,0.00,699.00,236.00,269.00,84.00,0.00,110.00
2024,11,OH,PSA Airlines Inc.,MSP,"Minneapolis, MN: Minneapolis-St Paul International",57.00,3.00,0.00,0.00,0.06,0.00,2.94,0.00,1.00,320.00,0.00,0.00,5.00,0.00,315.00
2024,11,OH,PSA Airlines Inc.,MSY,"New Orleans, LA: Louis Armstrong New Orleans International",33.00,9.00,4.56,2.06,1.56,0.00,0.81,1.00,0.00,644.00,270.00,299.00,42.00,0.00,33.00
