2024,11,OO,SkyWest Airlines Inc.,MSP,"Minneapolis, MN: Minneapolis-St Paul International",2169,296,193.95,60.06,40.78,1.21,0,0,0,24205,16300,5573,2300,32,0,MN,Midwest,West North Central,Minnesota
2024,11,OO,SkyWest Airlines Inc.,OAK,"Oakland, CA: Metro Oakland International",58,5,4.92,0,0.08,0,0,0,0,250,245,0,5,0,0,CA,West,Pacific,California
2024,11,OO,SkyWest Airlines Inc.,OKC,"Oklahoma City, OK: Will Rogers World",631,138,83.1,9.24,19,0,26.65,6,1,10234,5712,829,995,0,2698,OK,South,West South Central,Oklahoma
2024,11,OO,SkyWest Airlines Inc.,OMA,"Omaha, NE: Eppley Airfield",403,65,40.1,6.32,11.1,0,7.49,3,0,3714,2567,347,474,0,326,NE,Midwest,West North Central,Nebraska
2024,11,OO,SkyWest Airlines Inc.,ONT,"Ontario, CA: Ontario International",236,32,13,4.75,4.39,0,9.85,5,0,2338,1163,361,223,0,591,CA,West,Pacific,California
2024,11,OO,SkyWest Airlines Inc.,ORD,"Chicago, IL: Chicago O'Hare International",4182,795,468.38,51.17,102.27,0,173.18,29,0,70146,36403,12000,6192,0,15551,IL,Midwest,East North Central,Illinois
2024,11,OO,SkyWest Airlines Inc.,ORF,"Norfolk, VA: Norfolk International",63,15,10.02,1,3.98,0,0,0,0,635,442,64,129,0,0,VA,South,South Atlantic,Virginia
2024,11,OO,SkyWest Airlines Inc.,OTH,"North Bend/Coos Bay, OR: Southwest Oregon Regional",17,5,0.92,0.96,0.35,0,2.76,1,0,227,49,49,18,0,111,OR,West,Pacific,Oregon
2024,11,OO,SkyWest Airlines Inc.,PDX,"Portland, OR: Portland International",850,102,41.73,7.41,14.69,0,38.17,4,1,5039,1623,358,1023,0,2035,OR,West,Pacific,Oregon
2024,11,OO,SkyWest Airlines Inc.,PHL,"Philadelphia, PA: Philadelphia International",1,0,0,0,0,0,0,0,0,0,0,0,0,0,0,PA,Northeast,Mid-Atlantic,Pennsylvania
2024,11,OO,SkyWest Airlines Inc.,PHX,"Phoenix, AZ: Phoenix Sky Harbor International",2288,396,264.85,14.76,33.77,0,82.63,8,2,36590,26504,2168,1539,0,6379,AZ,West,Mountain,Arizona
2024,11,OO,SkyWest Airlines Inc.,PIA,"Peoria, IL: General Downing - Peoria International",47,12,5.49,0,0.68,0,5.84,2,0,1090,591,0,39,0,460,IL,Midwest,East North Central,Illinois
2024,11,OO,SkyWest Airlines Inc.,PIB,"Hattiesburg/Laurel, MS: Hattiesburg-Laurel Regional",52,9,4.66,0,0.87,0,3.48,0,0,593,271,0,47,0,275,MS,South,East South Central,Mississippi
2024,11,OO,SkyWest Airlines Inc.,PIH,"Pocatello, ID: Pocatello Regional",46,4,4,0,0,0,0,0,0,132,132,0,0,0,0,ID,West,Mountain,Idaho
2024,11,OO,SkyWest Airlines Inc.,PIT,"Pittsburgh, PA: Pittsburgh International",130,19,14.99,2.93,1.08,0,0,0,0,1102,768,287,47,0,0,PA,Northeast,Mid-Atlantic,Pennsylvania
2024,11,OO,SkyWest Airlines Inc.,PLN,"Pellston, MI: Pellston Regional Airport of Emmet County",53,9,7.89,0,1.11,0,0,0,0,727,451,0,276,0,0,MI,Midwest,East North Central,Michigan
2024,11,OO,SkyWest Airlines Inc.,PNS,"Pensacola, FL: Pensacola International",29,4,2.53,0.35,1.11,0,0,0,0,257,76,59,122,0,0,FL,South,South Atlantic,Florida
2024,11,OO,SkyWest Airlines Inc.,PRC,"Prescott, AZ: Prescott Regional Ernest A Love Field",59,14,3.17,1.7,1.71,0,7.42,1,0,1987,1342,100,76,0,469,AZ,West,Mountain,Arizona
2024,11,OO,SkyWest Airlines Inc.,PSC,"Pasco/Kennewick/Richland, WA: Tri Cities",409,51,27.05,6.03,6.67,0,11.26,2,1,2489,1350,252,282,0,605,WA,West,Pacific,Washington
2024,11,OO,SkyWest Airlines Inc.,PSP,"Palm Springs, CA: Palm Springs International",549,95,39.75,3.64,19.07,0,32.54,9,0,4640,1548,233,1118,0,1741,CA,West,Pacific,California
2024,11,OO,SkyWest Airlines Inc.,PVD,"Providence, RI: Rhode Island Tf Green International",112,24,16.17,3.51,2.51,0,1.82,0,0,1925,1181,485,205,0,54,RI,Northeast,New England,Rhode Island
2024,11,OO,SkyWest Airlines Inc.,PVU,"Provo, UT: Provo Municipal",114,41,24.42,1.43,5.52,0,9.63,2,0,2466,1172,163,537,0,594,UT,West,Mountain,Utah
2024,11,OO,SkyWest Airlines Inc.,PWM,"Portland, ME: Portland International Jetport",104,22,13.04,3.31,4.3,0,1.34,0,0,1215,714,229,246,0,26,ME,Northeast,New England,Maine
2024,11,OO,SkyWest Airlines Inc.,RAP,"Rapid City, SD: Rapid City Regional",234,43,15.59,2.42,11.18,0,13.8,4,2,3313,1094,198,667,0,1354,SD,Midwest,West North Central,South Dakota
2024,11,OO,SkyWest Airlines Inc.,RDD,"Redding, CA: Redding Regional",145,30,10.17,1,8.89,0,9.94,5,0,1692,486,22,555,0,629,CA,West,Pacific,California
2024,11,OO,SkyWest Airlines Inc.,RDM,"Bend/Redmond, OR: Roberts Field",302,39,17.4,2,6.78,0.8,12.02,4,0,1571,697,99,294,12,469,OR,West,Pacific,Oregon
2024,11,OO,SkyWest Airlines Inc.,RDU,"Raleigh/Durham, NC: Raleigh-Durham International",109,11,7.51,3,0.49,0,0,0,0,1152,835,274,43,0,0,NC,South,South Atlantic,North Carolina
2024,11,OO,SkyWest Airlines Inc.,RHI,"Rhinelander, WI: Rhinelander/Oneida County",59,11,8.3,1.39,1.31,0,0,0,0,1162,1000,82,80,0,0,WI,Midwest,East North Central,Wisconsin
2024,11,OO,SkyWest Airlines Inc.,RIC,"Richmond, VA: Richmond International",86,18,13.06,2.71,2.22,0,0,0,0,1259,995,103,161,0,0,VA,South,South Atlantic,Virginia
2024,11,OO,SkyWest Airlines Inc.,RIW,"Riverton/Lander, WY: Central Wyoming Regional",59,14,10.93,0,0.07,0,3,2,1,1018,929,0,6,0,83,WY,West,Mountain,Wyoming
2024,11,OO,SkyWest Airlines Inc.,RKS,"Rock Springs, WY: Southwest Wyoming Regional",59,12,2.33,3.67,3.03,0,2.97,2,0,670,94,243,193,0,140,WY,West,Mountain,Wyoming
2024,11,OO,SkyWest Airlines Inc.,RNO,"Reno, NV: Reno/Tahoe International",477,74,35.35,6.5,14.12,0,18.03,5,3,4638,1831,612,785,0,1410,NV,West,Mountain,Nevada
2024,11,OO,SkyWest Airlines Inc.,ROA,"Roanoke, VA: Roanoke Blacksburg Regional",60,13,9.14,2,0.86,0,1,0,0,1409,833,415,92,0,69,VA,South,South Atlantic,Virginia
2024,11,OO,SkyWest Airlines Inc.,ROC,"Rochester, NY: Frederick Douglass Grtr Rochester International",20,5,5,0,0,0,0,0,0,218,218,0,0,0,0,NY,Northeast,Mid-Atlantic,New York
2024,11,OO,SkyWest Airlines Inc.,ROW,"Roswell, NM: Roswell Air Center",87,19,9,1.46,2.37,0,6.17,4,0,960,403,93,115,0,349,NM,West,Mountain,New Mexico
2024,11,OO,SkyWest Airlines Inc.,RST,"Rochester, MN: Rochester International",83,12,6.98,2.03,1.99,1,0,0,0,1061,784,154,95,28,0,MN,Midwest,West North Central,Minnesota
2024,11,OO,SkyWest Airlines Inc.,SAF,"Santa Fe, NM: Santa Fe Municipal",286,69,36.23,8.92,11.5,0,12.34,15,4,6218,2033,1986,1393,0,806,NM,West,Mountain,New Mexico
2024,11,OO,SkyWest Airlines Inc.,SAN,"San Diego, CA: San Diego International",1116,318,137.37,13.49,70.03,0.05,97.05,7,5,20099,6674,2167,4861,1,6396,CA,West,Pacific,California
2024,11,OO,SkyWest Airlines Inc.,SAT,"San Antonio, TX: San Antonio International",110,14,5.34,0,2.68,0,5.98,1,0,727,187,0,99,0,441,TX,South,West South Central,Texas
2024,11,OO,SkyWest Airlines Inc.,SAV,"Savannah, GA: Savannah/Hilton Head International",21,2,1,0,0,0,1,0,0,174,58,0,0,0,116,GA,South,South Atlantic,Georgia
2024,11,OO,SkyWest Airlines Inc.,SBA,"Santa Barbara, CA: Santa Barbara Municipal",114,13,4.87,2,0.23,0,5.9,0,1,1531,737,512,23,0,259,CA,West,Pacific,California
2024,11,OO,SkyWest Airlines Inc.,SBN,"South Bend, IN: South Bend International",407,88,47.73,8.94,15.17,0,16.15,2,2,5593,3029,702,1056,0,806,IN,Midwest,East North Central,Indiana
2024,11,OO,SkyWest Airlines Inc.,SBP,"San Luis Obispo, CA: San Luis County Regional",388,83,31.05,5.3,16.53,0,30.12,6,0,5692,1511,1171,735,0,2275,CA,West,Pacific,California
2024,11,OO,SkyWest Airlines Inc.,SCE,"State College, PA: University Park",38,8,4.95,0.42,2.64,0,0,0,0,850,536,92,222,0,0,PA,Northeast,Mid-Atlantic,Pennsylvania
2024,11,OO,SkyWest Airlines Inc.,SDF,"Louisville, KY: Louisville Muhammad Ali International",121,15,12.82,0.05,2.13,0,0,0,0,650,537,4,109,0,0,KY,South,East South Central,Kentucky
2024,11,OO,SkyWest Airlines Inc.,SEA,"Seattle, WA: Seattle/Tacoma International",2084,251,153.92,31.21,35.18,1,29.69,5,1,13558,7297,2456,2332,63,1410,WA,West,Pacific,Washington
2024,11,OO,SkyWest Airlines Inc.,SFO,"San Francisco, CA: San Francisco International",2844,735,293.9,39.61,277.26,0,124.22,94,21,57062,17620,4786,24383,0,10273,CA,West,Pacific,California
2024,11,OO,SkyWest Airlines Inc.,SGF,"Springfield, MO: Springfield-Branson National",248,58,36.83,1.96,8.57,0,10.64,6,2,5718,4357,169,387,0,805,MO,Midwest,West North Central,Missouri
2024,11,OO,SkyWest Airlines Inc.,SGU,"St. George, UT: St George Regional",310,52,26.59,6.66,5.7,0,13.05,4,2,4688,2184,1165,434,0,905,UT,West,Mountain,Utah
2024,11,OO,SkyWest Airlines Inc.,SHR,"Sheridan, WY: Sheridan County",59,13,7.1,0.96,1.07,0,3.87,3,0,930,328,163,74,0,365,WY,West,Mountain,Wyoming
2024,11,OO,SkyWest Airlines Inc.,SHV,"Shreveport, LA: Shreveport Regional",72,12,8.08,1,2.61,0,0.31,2,0,630,503,33,86,0,8,LA,South,West South Central,Louisiana
2024,11,OO,SkyWest Airlines Inc.,SJC,"San Jose, CA: Norman Y. Mineta San Jose International",677,93,41.34,5.48,16.96,0,29.23,1,0,5304,2453,420,752,0,1679,CA,West,Pacific,California
2024,11,OO,SkyWest Airlines Inc.,SJT,"San Angelo, TX: San Angelo Regional/Mathis Field",75,11,5.86,0.87,0.85,0,3.42,1,1,538,236,41,52,0,209,TX,South,West South Central,Texas
2024,11,OO,SkyWest Airlines Inc.,SLC,"Salt Lake City, UT: Salt Lake City International",2509,219,131.07,28.59,27.26,0,32.08,7,0,13447,8002,2024,1244,0,2177,UT,West,Mountain,Utah
2024,11,OO,SkyWest Airlines Inc.,SLN,"Salina, KS: Salina Regional",59,11,5.2,0.85,3.13,0,1.82,1,0,546,153,175,157,0,61,KS,Midwest,West North Central,Kansas
2024,11,OO,SkyWest Airlines Inc.,SMF,"Sacramento, CA: Sacramento International",803,140,65.29,2.32,29.25,0,43.15,7,1,9877,5131,416,1644,0,2686,CA,West,Pacific,California
2024,11,OO,SkyWest Airlines Inc.,SNA,"Santa Ana, CA: John Wayne Airport-Orange County",338,67,17.75,1.92,15.29,0,32.03,10,0,3236,475,60,872,0,1829,CA,West,Pacific,California
2024,11,OO,SkyWest Airlines Inc.,SPS,"Wichita Falls, TX: Sheppard AFB/Wichita Falls Municipal",8,5,2,1.61,1.39,0,0,1,0,697,189,291,217,0,0,TX,South,West South Central,Texas
2024,11,OO,SkyWest Airlines Inc.,SRQ,"Sarasota/Bradenton, FL: Sarasota/Bradenton International",19,0,0,0,0,0,0,0,0,0,0,0,0,0,0,FL,South,South Atlantic,Florida
2024,11,OO,SkyWest Airlines Inc.,STL,"St. Louis, MO: St Louis Lambert International",60,13,7.83,1.53,2.64,0,1,0,0,1065,824,58,138,0,45,MO,Midwest,West North Central,Missouri
2024,11,OO,SkyWest Airlines Inc.,STS,"Santa Rosa, CA: Charles M. Schulz - Sonoma County",317,106,35.57,2.57,26.79,0,41.06,3,2,4706,1336,273,1363,0,1734,CA,West,Pacific,California
2024,11,OO,SkyWest Airlines Inc.,SUN,"Sun Valley/Hailey/Ketchum, ID: Friedman Memorial",89,5,2.38,1,1.62,0,0,1,0,228,60,18,150,0,0,ID,West,Mountain,Idaho
2024,11,OO,SkyWest Airlines Inc.,SUX,"Sioux City, IA: Sioux Gateway Brig Gen Bud Day Field",59,15,8.25,0.89,1.86,0,4,1,1,880,288,73,124,0,395,IA,Midwest,West North Central,Iowa
2024,11,OO,SkyWest Airlines Inc.,SWO,"Stillwater, OK: Stillwater Regional",59,13,5,3.02,0.98,0,4,1,0,651,195,251,82,0,123,OK,South,West South Central,Oklahoma
2024,11,OO,SkyWest Airlines Inc.,SYR,"Syracuse, NY: Syracuse Hancock International",146,37,26.51,5.97,4.52,0,0,0,0,2445,1452,705,288,0,0,NY,Northeast,Mid-Atlantic,New York
2024,11,OO,SkyWest Airlines Inc.,TUL,"Tulsa, OK: Tulsa International",291,52,30.85,7.64,8.86,0,4.65,4,1,3001,1791,411,539,0,260,OK,South,West South Central,Oklahoma
2024,11,OO,SkyWest Airlines Inc.,TUS,"Tucson, AZ: Tucson International",732,125,69.09,6.45,15.61,0,33.84,1,0,7468,4396,423,1008,0,1641,AZ,West,Mountain,Arizona
2024,11,OO,SkyWest Airlines Inc.,TVC,"Traverse City, MI: Cherry Capital",55,8,5.35,1.24,1.41,0,0,0,0,583,354,161,68,0,0,MI,Midwest,East North Central,Michigan
2024,11,OO,SkyWest Airlines Inc.,TWF,"Twin Falls, ID: Joslin Field - Magic Valley Regional",46,4,4,0,0,0,0,0,0,289,289,0,0,0,0,ID,West,Mountain,Idaho
2024,11,OO,SkyWest Airlines Inc.,TXK,"Texarkana, AR: Texarkana Regional-Webb Field",59,15,5.96,2.16,1.88,0,5,1,0,1344,944,103,77,0,220,AR,South,West South Central,Arkansas
2024,11,OO,SkyWest Airlines Inc.,TYR,"Tyler, TX: Tyler Pounds Regional",87,22,11.64,3.84,0.86,0,5.67,6,0,1223,581,389,42,0,211,TX,South,West South Central,Texas
2024,11,OO,SkyWest Airlines Inc.,TYS,"Knoxville, TN: McGhee Tyson",88,15,8.45,1,4.02,0,1.53,0,0,922,348,254,200,0,120,TN,South,East South Central,Tennessee
2024,11,OO,SkyWest Airlines Inc.,VCT,"Victoria, TX: Victoria Regional",52,8,2.97,1,0.39,0,3.63,0,0,1470,951,21,27,0,471,TX,South,West South Central,Texas
2024,11,OO,SkyWest Airlines Inc.,XNA,"Fayetteville, AR: Northwest Arkansas National",198,37,19.32,3.3,9.29,0,5.09,2,2,2136,766,380,594,0,396,AR,South,West South Central,Arkansas
2024,11,OO,SkyWest Airlines Inc.,XWA,"Williston, ND: Williston Basin International",169,30,14.66,3.71,5.68,0,5.95,5,2,3267,677,1171,327,0,1092,ND,Midwest,West North Central,North Dakota
2024,11,OO,SkyWest Airlines Inc.,YUM,"Yuma, AZ: Yuma MCAS/Yuma International",135,29,15.12,0.55,3.85,0,9.49,1,0,2948,2399,12,153,0,384,AZ,West,Mountain,Arizona
2024,11,PT,Piedmont Airlines,AGS,"Augusta, GA: Augusta Regional at Bush Field",46,10,5.13,0,1.76,0,3.1,0,0,550,299,0,78,0,173,GA,South,South Atlantic,Georgia
2024,11,PT,Piedmont Airlines,ALB,"Albany, NY: Albany International",151,24,3.99,1.13,9.63,0,9.25,0,0,2784,830,300,484,0,1170,NY,Northeast,Mid-Atlantic,New York
2024,11,PT,Piedmont Airlines,ALO,"Waterloo, IA: Waterloo Regional",7,1,0,0.9,0.1,0,0,0,0,90,0,81,9,0,0,IA,Midwest,West North Central,Iowa
2024,11,PT,Piedmont Airlines,ART,"Watertown, NY: Watertown International",59,1,0,0,1,0,0,4,0,33,0,0,33,0,0,NY,Northeast,Mid-Atlantic,New York
2024,11,PT,Piedmont Airlines,AVL,"Asheville, NC: Asheville Regional",91,4,1.03,0,0.59,0,2.37,1,0,238,44,0,50,0,144,NC,South,South Atlantic,North Carolina
2024,11,PT,Piedmont Airlines,BDL,"Hartford, CT: Bradley International",79,2,1,0,0.89,0,0.11,0,0,73,38,0,31,0,4,CT,Northeast,New England,Connecticut
2024,11,PT,Piedmont Airlines,BGR,"Bangor, ME: Bangor International",83,4,2.4,0,1.15,0,0.45,0,1,159,104,0,23,0,32,ME,Northeast,New England,Maine
2024,11,PT,Piedmont Airlines,BNA,"Nashville, TN: Nashville International",28,2,1,0,0.18,0,0.82,0,0,140,123,0,3,0,14,TN,South,East South Central,Tennessee
2024,11,PT,Piedmont Airlines,BOS,"Boston, MA: Logan International",101,8,2.06,0,2.82,0,3.11,0,0,399,147,0,113,0,139,MA,Northeast,New England,Massachusetts
2024,11,PT,Piedmont Airlines,BUF,"Buffalo, NY: Buffalo Niagara International",80,3,1,0,0,0,2,0,0,148,41,0,0,0,107,NY,Northeast,Mid-Atlantic,New York
2024,11,PT,Piedmont Airlines,CAE,"Columbia, SC: Columbia Metropolitan",143,12,5.1,0.64,4.08,0,2.18,0,0,578,403,25,95,0,55,SC,South,South Atlantic,South Carolina
2024,11,PT,Piedmont Airlines,CAK,"Akron, OH: Akron-Canton Regional",2,0,0,0,0,0,0,0,0,0,0,0,0,0,0,OH,Midwest,East North Central,Ohio
2024,11,PT,Piedmont Airlines,CHA,"Chattanooga, TN: Lovell Field",68,3,1.14,0,1.31,0,0.54,0,0,84,31,0,34,0,19,TN,South,East South Central,Tennessee
2024,11,PT,Piedmont Airlines,CHO,"Charlottesville, VA: Charlottesville Albemarle",196,10,5.48,0,2.02,0,2.5,0,0,418,234,0,58,0,126,VA,South,South Atlantic,Virginia
2024,11,PT,Piedmont Airlines,CLE,"Cleveland, OH: Cleveland-Hopkins International",78,5,1.31,0,2.79,0,0.89,0,0,176,32,0,93,0,51,OH,Midwest,East North Central,Ohio
2024,11,PT,Piedmont Airlines,CLT,"Charlotte, NC: Charlotte Douglas International",2699,353,61.99,8,145.03,0.4,137.58,6,7,18158,5020,850,3792,21,8475,NC,South,South Atlantic,North Carolina
2024,11,PT,Piedmont Airlines,CVG,"Cincinnati, OH: Cincinnati/Northern Kentucky International",28,0,0,0,0,0,0,0,0,0,0,0,0,0,0,OH,Midwest,East North Central,Ohio
2024,11,PT,Piedmont Airlines,CWA,"Mosinee, WI: Central Wisconsin",8,2,0,0,0.72,0,1.28,0,1,183,0,0,27,0,156,WI,Midwest,East North Central,Wisconsin
2024,11,PT,Piedmont Airlines,DAY,"Dayton, OH: James M Cox/Dayton International",4,0,0,0,0,0,0,0,0,0,0,0,0,0,0,OH,Midwest,East North Central,Ohio
2024,11,PT,Piedmont Airlines,DSM,"Des Moines, IA: Des Moines International",1,0,0,0,0,0,0,0,0,0,0,0,0,0,0,IA,Midwest,West North Central,Iowa
2024,11,PT,Piedmont Airlines,DTW,"Detroit, MI: Detroit Metro Wayne County",21,0,0,0,0,0,0,0,0,0,0,0,0,0,0,MI,Midwest,East North Central,Michigan
2024,11,PT,Piedmont Airlines,ERI,"Erie, PA: Erie International/Tom Ridge Field",86,9,3.31,0,4.72,0,0.97,6,1,483,199,0,110,0,174,PA,Northeast,Mid-Atlantic,Pennsylvania
2024,11,PT,Piedmont Airlines,EVV,"Evansville, IN: Evansville Regional",86,6,1.68,0,3.32,0,1,0,0,269,89,0,104,0,76,IN,Midwest,East North Central,Indiana
2024,11,PT,Piedmont Airlines,EWN,"New Bern/Morehead/Beaufort, NC: Coastal Carolina Regional",139,19,5.4,0.79,3.07,0,9.74,0,0,975,269,30,139,0,537,NC,South,South Atlantic,North Carolina
2024,11,PT,Piedmont Airlines,FAY,"Fayetteville, NC: Fayetteville Regional/Grannis Field",147,14,4.07,1,3.04,0,5.89,0,2,873,205,42,96,0,530,NC,South,South Atlantic,North Carolina
2024,11,PT,Piedmont Airlines,FLO,"Florence, SC: Florence Regional",85,4,0.85,0,0,0,3.15,0,0,852,516,0,0,0,336,SC,South,South Atlantic,South Carolina
2024,11,PT,Piedmont Airlines,FWA,"Fort Wayne, IN: Fort Wayne International",54,6,3.67,0,1.58,0,0.75,0,0,385,175,0,87,0,123,IN,Midwest,East North Central,Indiana
2024,11,PT,Piedmont Airlines,GNV,"Gainesville, FL: Gainesville Regional",97,11,2.84,0,5.19,0,2.97,0,0,549,203,0,179,0,167,FL,South,South Atlantic,Florida
2024,11,PT,Piedmont Airlines,GRR,"Grand Rapids, MI: Gerald R. Ford International",58,3,0,0,1.12,0,1.88,0,0,72,0,0,27,0,45,MI,Midwest,East North Central,Michigan
2024,11,PT,Piedmont Airlines,GSO,"Greensboro/High Point, NC: Piedmont Triad International",120,6,1.12,0,3.07,0,1.8,0,0,253,68,0,76,0,109,NC,South,South Atlantic,North Carolina
2024,11,PT,Piedmont Airlines,GSP,"Greer, SC: Greenville-Spartanburg International",43,2,1.71,0,0.29,0,0,0,0,34,29,0,5,0,0,SC,South,South Atlantic,South Carolina
2024,11,PT,Piedmont Airlines,HSV,"Huntsville, AL: Huntsville International-Carl T Jones Field",124,11,2.82,0,4.31,0,3.86,0,0,375,83,0,119,0,173,AL,South,East South Central,Alabama
2024,11,PT,Piedmont Airlines,HTS,"Ashland, WV: Tri-State/Milton J. Ferguson Field",86,8,3.68,0,3.21,0,1.11,0,0,418,189,0,196,0,33,WV,South,South Atlantic,West Virginia
2024,11,PT,Piedmont Airlines,ILM,"Wilmington, NC: Wilmington International",76,7,3.45,0,2,0,1.55,0,0,236,108,0,73,0,55,NC,South,South Atlantic,North Carolina
2024,11,PT,Piedmont Airlines,JAN,"Jackson/Vicksburg, MS: Jackson Medgar Wiley Evers International",45,8,1.78,0,4.92,0,1.3,0,0,353,78,0,143,0,132,MS,South,East South Central,Mississippi
2024,11,PT,Piedmont Airlines,LEX,"Lexington, KY: Blue Grass",5,1,0.54,0,0,0,0.46,0,0,46,25,0,0,0,21,KY,South,East South Central,Kentucky
2024,11,PT,Piedmont Airlines,LSE,"La Crosse, WI: La Crosse Regional",2,1,0,0,1,0,0,0,0,25,0,0,25,0,0,WI,Midwest,East North Central,Wisconsin
2024,11,PT,Piedmont Airlines,LYH,"Lynchburg, VA: Lynchburg Regional/Preston Glenn Field",153,10,2.66,0,3.09,0.87,3.37,0,0,706,191,0,56,62,397,VA,South,South Atlantic,Virginia
2024,11,PT,Piedmont Airlines,MDT,"Harrisburg, PA: Harrisburg International",234,25,6.32,1.34,6.78,0,10.56,0,0,1651,320,227,364,0,740,PA,Northeast,Mid-Atlantic,Pennsylvania
2024,11,PT,Piedmont Airlines,MGM,"Montgomery, AL: Montgomery Regional",59,5,1.5,0,2,1,0.5,0,0,93,25,0,30,28,10,AL,South,East South Central,Alabama
2024,11,PT,Piedmont Airlines,MHT,"Manchester, NH: Manchester Boston Regional",73,5,0.79,0,1.29,0,2.92,0,1,204,47,0,35,0,122,NH,Northeast,New England,New Hampshire
2024,11,PT,Piedmont Airlines,MKE,"Milwaukee, WI: General Mitchell International",12,2,0.23,0,1,0,0.77,0,0,189,40,0,17,0,132,WI,Midwest,East North Central,Wisconsin
2024,11,PT,Piedmont Airlines,MOB,"Mobile, AL: Mobile Regional",83,10,3.39,0,3.28,0,3.33,0,0,575,192,0,94,0,289,AL,South,East South Central,Alabama
2024,11,PT,Piedmont Airlines,MSN,"Madison, WI: Dane County Regional-Truax Field",59,6,0,0.73,4.15,0,1.12,0,0,210,0,49,79,0,82,WI,Midwest,East North Central,Wisconsin
2024,11,PT,Piedmont Airlines,MYR,"Myrtle Beach, SC: Myrtle Beach International",48,5,1.18,0,1.38,0,2.44,0,0,220,76,0,22,0,122,SC,South,South Atlantic,South Carolina
2024,11,PT,Piedmont Airlines,OAJ,"Jacksonville/Camp Lejeune, NC: Albert J Ellis",86,10,2.82,0,4.72,0,2.46,0,0,349,116,0,151,0,82,NC,South,South Atlantic,North Carolina
2024,11,PT,Piedmont Airlines,ORD,"Chicago, IL: Chicago O'Hare International",441,67,18.96,3.81,26.22,0,18.01,3,2,5868,1962,450,882,0,2574,IL,Midwest,East North Central,Illinois
2024,11,PT,Piedmont Airlines,ORF,"Norfolk, VA: Norfolk International",80,5,1.68,0,1.35,0,1.97,0,0,105,31,0,31,0,43,VA,South,South Atlantic,Virginia
2024,11,PT,Piedmont Airlines,PGV,"Greenville, NC: Pitt Greenville",83,9,2.26,0,3.69,0,3.05,0,0,607,221,0,115,0,271,NC,South,South Atlantic,North Carolina
2024,11,PT,Piedmont Airlines,PHF,"Newport News/Williamsburg, VA: Newport News/Williamsburg International",152,9,1.48,0,2.49,0,5.03,0,0,414,59,0,79,0,276,VA,South,South Atlantic,Virginia
2024,11,PT,Piedmont Airlines,PHL,"Philadelphia, PA: Philadelphia International",1707,161,34.34,1.81,56.01,0,68.84,3,0,11644,3063,113,2020,0,6448,PA,Northeast,Mid-Atlantic,Pennsylvania
2024,11,PT,Piedmont Airlines,PIT,"Pittsburgh, PA: Pittsburgh International",49,2,1,0,0.26,0,0.74,0,0,66,28,0,10,0,28,PA,Northeast,Mid-Atlantic,Pennsylvania
2024,11,PT,Piedmont Airlines,PWM,"Portland, ME: Portland International Jetport",2,1,0.76,0,0.24,0,0,0,0,82,62,0,20,0,0,ME,Northeast,New England,Maine
2024,11,PT,Piedmont Airlines,RIC,"Richmond, VA: Richmond International",143,21,8.54,0.98,4.92,0,6.57,0,0,2615,724,1156,198,0,537,VA,South,South Atlantic,Virginia
2024,11,PT,Piedmont Airlines,ROA,"Roanoke, VA: Roanoke Blacksburg Regional",188,25,8.7,0,9.11,0,7.19,0,0,1976,978,0,329,0,669,VA,South,South Atlantic,Virginia
2024,11,PT,Piedmont Airlines,ROC,"Rochester, NY: Frederick Douglass Grtr Rochester International",136,10,5.43,0,1.55,0,3.02,0,0,368,175,0,27,0,166,NY,Northeast,Mid-Atlantic,New York
2024,11,PT,Piedmont Airlines,RST,"Rochester, MN: Rochester International",24,0,0,0,0,0,0,1,0,0,0,0,0,0,0,MN,Midwest,West North Central,Minnesota
2024,11,PT,Piedmont Airlines,SAV,"Savannah, GA: Savannah/Hilton Head International",2,0,0,0,0,0,0,0,0,0,0,0,0,0,0,GA,South,South Atlantic,Georgia
2024,11,PT,Piedmont Airlines,SBY,"Salisbury, MD: Salisbury-Ocean City/Wicomico Regional",166,14,3.45,0,3.94,0,6.61,0,0,734,222,0,139,0,373,MD,South,South Atlantic,Maryland
2024,11,PT,Piedmont Airlines,SCE,"State College, PA: University Park",56,6,3.99,0,0.01,0,2,0,0,458,337,0,1,0,120,PA,Northeast,Mid-Atlantic,Pennsylvania
2024,11,PT,Piedmont Airlines,SDF,"Louisville, KY: Louisville Muhammad Ali International",53,2,1,0,1,0,0,0,0,71,36,0,35,0,0,KY,South,East South Central,Kentucky
2024,11,PT,Piedmont Airlines,SPI,"Springfield, IL: Abraham Lincoln Capital",2,0,0,0,0,0,0,0,0,0,0,0,0,0,0,IL,Midwest,East North Central,Illinois
2024,11,PT,Piedmont Airlines,SYR,"Syracuse, NY: Syracuse Hancock International",105,7,1.11,0,0.66,0,5.22,0,0,477,68,0,23,0,386,NY,Northeast,Mid-Atlantic,New York
2024,11,PT,Piedmont Airlines,TLH,"Tallahassee, FL: Tallahassee International",95,8,2.6,0,3.15,0,2.24,0,0,299,95,0,90,0,114,FL,South,South Atlantic,Florida
2024,11,PT,Piedmont Airlines,TRI,"Bristol/Johnson City/Kingsport, TN: Tri Cities",167,18,5.21,0.71,4.4,0,7.68,0,0,658,249,17,98,0,294,TN,South,East South Central,Tennessee
2024,11,PT,Piedmont Airlines,TVC,"Traverse City, MI: Cherry Capital",72,8,0.62,0.05,3.18,0,4.15,0,0,1030,17,14,202,0,797,MI,Midwest,East North Central,Michigan
2024,11,PT,Piedmont Airlines,TYS,"Knoxville, TN: McGhee Tyson",143,21,3,1.73,8.78,0,7.49,1,0,2245,193,871,312,0,869,TN,South,East South Central,Tennessee
2024,11,QX,Horizon Air,ABQ,"Albuquerque, NM: Albuquerque International Sunport",29,3,1.13,0,1.1,0,0.77,0,0,231,51,0,46,0,134,NM,West,Mountain,New Mexico
2024,11,QX,Horizon Air,AKN,"King Salmon, AK: King Salmon Airport",29,5,3,0,0.4,0,1.6,2,0,246,186,0,8,0,52,AK,West,Pacific,Alaska
2024,11,QX,Horizon Air,ALW,"Walla Walla, WA: Walla Walla Regional",59,3,1,0,1,0,1,2,0,196,32,0,60,0,104,WA,West,Pacific,Washington
2024,11,QX,Horizon Air,ANC,"Anchorage, AK: Ted Stevens Anchorage International",332,51,8.26,1.94,17.85,0,22.96,8,0,2118,286,53,463,0,1316,AK,West,Pacific,Alaska
2024,11,QX,Horizon Air,BET,"Bethel, AK: Bethel Airport",12,2,0,0,2,0,0,0,0,53,0,0,53,0,0,AK,West,Pacific,Alaska
2024,11,QX,Horizon Air,BIL,"Billings, MT: Billings Logan International",100,3,0.87,0,0.23,0,1.9,1,1,95,47,0,9,0,39,MT,West,Mountain,Montana
2024,11,QX,Horizon Air,BOI,"Boise, ID: Boise Air Terminal",363,35,14.74,0,6.15,0,14.11,1,0,1857,984,0,192,0,681,ID,West,Mountain,Idaho
2024,11,QX,Horizon Air,BRW,"Barrow, AK: Wiley Post/Will Rogers Memorial",4,0,0,0,0,0,0,0,0,0,0,0,0,0,0,AK,West,Pacific,Alaska
2024,11,QX,Horizon Air,BUR,"Burbank, CA: Bob Hope",4,0,0,0,0,0,0,1,0,0,0,0,0,0,0,CA,West,Pacific,California
2024,11,QX,Horizon Air,BZN,"Bozeman, MT: Bozeman Yellowstone International",74,8,4.33,0.4,1.27,0,2,0,1,229,161,6,28,0,34,MT,West,Mountain,Montana
2024,11,QX,Horizon Air,DLG,"Dillingham, AK: Dillingham Airport",29,3,1.95,0,1.05,0,0,1,0,107,77,0,30,0,0,AK,West,Pacific,Alaska
2024,11,QX,Horizon Air,EAT,"Wenatchee, WA: Pangborn Memorial",59,9,0.99,2,4.01,0,2,2,0,373,102,108,111,0,52,WA,West,Pacific,Washington
2024,11,QX,Horizon Air,ELP,"El Paso, TX: El Paso International",29,2,2,0,0,0,0,0,1,157,157,0,0,0,0,TX,South,West South Central,Texas
2024,11,QX,Horizon Air,EUG,"Eugene, OR: Mahlon Sweet Field",83,10,5.14,0,1.17,0,3.7,1,0,624,411,0,37,0,176,OR,West,Pacific,Oregon
2024,11,QX,Horizon Air,FAI,"Fairbanks, AK: Fairbanks International",171,23,4.61,0,6.55,0,11.84,1,0,965,177,0,189,0,599,AK,West,Pacific,Alaska
2024,11,QX,Horizon Air,FAT,"Fresno, CA: Fresno Yosemite International",3,0,0,0,0,0,0,0,0,0,0,0,0,0,0,CA,West,Pacific,California
2024,11,QX,Horizon Air,FCA,"Kalispell, MT: Glacier Park International",67,6,2.9,0,0.66,0,2.44,1,0,246,108,0,15,0,123,MT,West,Mountain,Montana
2024,11,QX,Horizon Air,GEG,"Spokane, WA: Spokane International",209,21,3,0,5.37,0,12.64,1,0,1105,141,0,126,0,838,WA,West,Pacific,Washington
2024,11,QX,Horizon Air,GTF,"Great Falls, MT: Great Falls International",29,4,3,0,0,0,1,0,0,229,213,0,0,0,16,MT,West,Mountain,Montana
2024,11,QX,Horizon Air,HLN,"Helena, MT: Helena Regional",29,4,2.05,0,1.6,0,0.35,0,0,82,45,0,30,0,7,MT,West,Mountain,Montana
